tb9id,uid,sid,topID,quesID,quesAns,bonusWord,bonusWordCnt,bonusMoney
199,416,2004,1,k2,"Bone grafts can be done from individual or donor.  Recovery and pain may be more prevalent when bone comes from individual because it requires to surgeries.  Body may reject bone from donor.  Common areas within the body for bone transplants are done include knees, lower back and legs.

Cornea transplants could be transplant of total eye or one of three layers.  Cornea transplants are more common and require less waiting time because corneas are harvested from dead people.  Corneas do not gain nutrition from blood supply but rather from oxygen in tears.  Transplants are done for damaged or diseased eyes.

Blood transfusions are safer now because of testing done to check medical history from donors and way in which blood is withdrawn.  Blood can be separated time of transfusion to remove white blood cells as some may be allergic to white blood cells.  Types of blood include A, B, AB and O.  O is universal type of blood.  Different geographic regions may have more prevalent type of blood.  Asia and India  Type A.
When babies are born a small percentage may have a liver function issue to remove billrubin from blood.  This requires a regular transfusion to remove.  Blood can be stored for many years in either a live state or freeze state.  Less likely to transmit disease in freeze state.  
",bone donor recovery pain bone surgeries body bone donor body bone transplants knees cornea transplants transplant eye layers cornea transplants corneas corneas nutrition blood supply oxygen tears transplants eyes blood transfusions testing history donors blood blood transfusion blood cells blood cells blood blood blood liver function blood transfusion blood freeze disease freeze,52,2.60
200,417,2005,1,k2,"Bone Grafts: come from used for knees, hips, spines.  3 types: from self, a donor (deceased), man-made material.  Donated material is checked for diseases and other things that make it not suitable; it is frozen and kept tip needed at a bone tissue bank.  When needed a deep cut is made in the bone and the graft material inserted; the graft material provides a structure for new growth of bone.  A doctor can inadvertently cut a nerve which can result in chronic pain.  Additionally there is a small possibility that the graft will be rejected by the body.

Blood donation: Humans have 4 blood types: a, b, ab or o.  O is a universal donor material that can be used by anyone; AB is a universal receiver - it can have transfusions of any of the blood types.  Blood donations are normally whole blood, but there are specialized donations of just red blood cells, platelets or plasma - one is hooked to a machine and this process extracts the desired ingredient and the remained is injected back into the donor.  Some people are allergic to white blood cells in a transfusion and that is a reason they are sometimes removed.  After the blood is donated it is normally stored in a flexible plastic bag; it has anti-clotting agents added and is refrigerated; donated blood can be kept up to a few years.  Blood donors are tested for diseases (HIV for example) and disqualified from donating.  A blood donor regenerates the fluids removed in a day and the blood cells in about a month.  People under 110 pounds are disqualified, as are pregnant women up until 6 weeks after the birth of the child.  There is no maximum weight limit for a donor except if the weight is too great for the chair they will be using.  A blood donation is normally about a pint.  Dizzyness is a potential after effect of donating blood, more common in people with low weight.

Corneal Transplants:  the cornea consists of three layers:  ehelium outer layer; stoma middle layer, and exhelium inner layer.
The outer layer protects the cornea from physical damage, it extracts oxygen from tears to nourish the cornea, and one other thing.  The middle layer is about 90% of the thickness of the cornea and is made up of about 100 layers.  Corneal transplants can replace the entire cornea or just some layers.  If the entire cornea is replaced, the new cornea is held in place with very thin nylon suchers. If just the top layer is replaced it is also held in place with thin nylon suchers.  If just the bottom layer is replaced, a bubble of air is inserted under it and that holds it in place until it heals.  Transplants take a long time to heal - up to a year, and the suckers are often left in that long.  It may often take up to a year for full vision acuity to return.  Many people allow their corneas to be harvested when they die, so there is typically not a long wait for a transplant.",bone knees hips spines donor material material diseases bone tissue bank bone graft material graft material growth bone nerve result pain graft body blood donation blood donor material transfusions blood blood donations blood donations blood cells platelets plasma machine process donor blood cells transfusion blood plastic agents blood blood donors diseases blood donor fluids blood cells pounds birth weight limit donor weight blood donation pint blood weight transplants cornea layers layer layer layer layer cornea damage oxygen tears cornea layer thickness cornea layers transplants cornea layers cornea cornea nylon layer nylon layer bubble air transplants vision acuity return corneas transplant,100,5.00
201,418,2006,1,k2,"Blood can be donated by persons age 16-17 depending on state.
Whole blood can e taken from a vein and deposited in a pouch.
Or blood can be separated into components and stored for use.
Blood contains red blood cells and white platelets.
Blood can be refrigerated to prevent coagulation.
Blood can be type A,B, or O; O is most common, about 40 percent
  Of people have type O.  Percents depend on geographic areas.
Persons who weigh less may be more affected by donating blood,
Becoming dizzy or having some reaction.
Donated blood is checked for certain complications like HIV,
Hepatitis, etc.
Blood can be negative or positive and it affects the matching
Opportunities between donor and recipient.
A blood donor restores lost fluids  within 48 hours, and red
Blood cells over a period of days.

Bone grafting can be allygraft (  from another person),
Or autograft (from another part of the body).
Grafting can be helpful(restorative) after surgery that has
Affected the bone or injury to the bone.  Sometimes the grafting is rejected.
",blood age blood vein blood components blood blood cells platelets blood coagulation blood blood reaction blood complications hepatitis blood donor blood donor fluids blood cells period bone autograft body surgery bone injury bone,33,1.65
202,419,1011,1,k2,"Bone grafts  allografts are from other people
-	largely come from deceased
-	special screening and immaculate conditions needed to prevent contamination
		Autografts are from your person
-	require two surgeries, usually get unnecessary bone, example was from the hip
-	wont be rejected
Largely used in hip, knee, and spine surgery
Used to repair bone, tendons, and cartilage
Athletes use it to grow new bone
People who get spine surgery use it to improve density and strength of bone

Corneal transplants  there are three layers of the cornea, epi-, endo- (most inside), and stroma (middle)

Kerato- seems to be the prefix for cornea

Transplants come from the deceased and are fairly popular meaning shorter waiting times for patients

There are multiple diseases that might need a corneal transplant, examples: Keratoconus (cone-shaped cornea), post cataract surgery if damaged, and another one I cant remember the name of about the innermost layer having cells deteriorate and blistering and swelling 


Blood donation- taken with large needle to prevent damaging useful red blood cells
		Apheresis is another type of extraction method
-	uses a machine
-	separates out red blood cells, plasma, and platelets for specific purposes
Can donate 1 pint in a sitting
Liquids are replaced by the body within a day and the red blood cells within the next few weeks

",bone screening conditions contamination surgeries bone hip hip knee spine surgery repair bone tendons cartilage athletes bone spine surgery density strength bone transplants layers cornea stroma cornea transplants patients diseases transplant cornea cataract surgery layer cells blood donation needle blood cells apheresis method machine blood cells plasma platelets pint body blood cells,52,2.60
203,421,2007_2,1,k2,"Learned three types of bone graft: allo, auto, and artificial. Two types of cell have different functions: osteo--- ones build up bone, other  osteoclastic  breaks down bone. The goal is to have cells generate new bone.   Source of bone from other (deceasd) donors are prepared to be free of disease, infection, etc. 
Pain can result from surgery (esp. if nerve cut or damaged). Crest of pelvis good source of cells or bone. 



Three layers of the cornea (which is clear and has no blood supply, so gets oxygen from tears).  Epithelial, endothelial, and ?stoma. Most transplants from deceased donors (most common types).  Can have partial (different layer) transplant.  Can restore lost vision.  
",bone graft cell functions bone bone cells bone bone donors disease infection pain result surgery nerve cells bone layers cornea blood supply oxygen tears transplants donors layer transplant vision,29,1.45
204,422,2008,1,k2,"Corneas have 3 layers, the epithelial, the stroma, and the endothelial. Only the epithelial layer has the ability to regenerate. The epithelial layer is the thinnest layer. The stroma is about 90% of the cornea in thickness. The purpose of the epithelial layer is to prevent objects from entering the eye and to help focus light. It is sensitive and that helps prevent injury. It also absorbs nutrients from the tears since the cornea does not have blood vessels. The stroma has a large number of layers. If one layer is damaged or diseased, a medical procedure can replace just the damaged layer. Some stroma cells can do some repair. The endothelial layer can stretch to cover damaged or diseased cells, but this reduces the transparency of the cornea. Corneas can be replaced using donated corneas. These come from deceased persons. More corneas are donated than other organs so people needing cornea transplants do not need to wait long. The transplant is done with a tiny instrument that looks like a tiny cookie cutter. After the epithelial layer is operated on, it is joined with nylon sutures. They can be left for weeks or even permanently. Just a few of The stroma layers can be operated on at one time if needed. When the endothelial layer is operated on, the surgeon may use a needle to force a small bubble of air between the stroma and endothelial layer to force the endothelial layer into place. It is not sutured and this allows it to heal faster.

Blood donations are used to get needed red blood cells, plasma, and another item. The red blood cells can be damaged while withdrawn so a large needle is used to prevent that. The blood is stored in flexible plastic bags. A procedure can draw blood and separate it into blood cells, plasma or other and retain only the needed part. A donor can donate a pint of blood and will regenerate it in 24 hour. 

Bone grafts can be 12 inches long. Bone is regenerated from live cells. One article also described artificial bone that can help a destroyed bone to regenerate. The bone graft can be from the patients own bone and is usually taken from the pubic area. Bone marrow can be used to help regenerate bone. If a surgical operation is needed, the patient will take longer to heal. If bone marrow is used, the surgeon can extract the marrow with a needle and insert it with a needle. This will result in shorter healing time. Bone has two layers.
",corneas layers stroma layer layer layer stroma cornea thickness layer eye focus light injury nutrients tears cornea blood vessels stroma layers layer procedure layer stroma cells repair layer stretch cells cornea corneas corneas corneas organs cornea transplants transplant cookie cutter layer nylon sutures stroma layers layer surgeon needle force bubble air stroma layer force layer blood donations blood cells plasma blood cells needle blood plastic procedure blood blood cells plasma donor pint blood bone bone cells bone bone bone graft patients bone bone marrow bone operation patient bone marrow surgeon marrow needle needle result healing bone layers,97,4.85
205,423,2009,1,k2,"Bone graphs are used to repair damage.  The sources can be from the same patient called an autograph or from donor called an allograph or synthetic.  Doctors may cut into the bone area and the after effects may be painful to varying degrees.  The source of material from others is usually a deceased person who has agreed to be a donor.

Eye part transplants are done to correct various deficiencies that impact vision.  Most conditions are due to hereditary conditions but some come from infections such as Type 1 herpes. Cornea transplants can involve up to three layers. For the inner layer, the doctor will insert a device that sonically destroys the inner layer for easy removal. Replacement  can be from a donor or synthetic. 

Blood transfusions can involve whole blood or components such a red, white platelet or plasma . The component donation takes longer and includes returning the uncollected portion back to the donor. This return portion is supplemented with saline solution to maintain the donors blood pressure.  If donating platelets the patient is asked to stop taking aspirin.

The shelf life of these donated components varies from days to years.  The advantage of self donation is avoidance of tissue rejection.  In the case of materials received from others, special attention is paid to match patient to donor to minimize rejection. 


",bone repair damage patient donor doctors bone effects material donor eye transplants deficiencies vision conditions conditions infections herpes cornea transplants layers layer layer replacement donor blood transfusions blood components plasma component donation donor return saline donors blood pressure platelets patient aspirin life components donation tissue rejection case materials patient donor rejection,51,2.55
206,424,1012,1,k2,"-there are 3 different layers in the cornea
-the top layer is the epithelium
-the bottom layer is the endothelium
-the middle layer is the stroma
-any combination or single one of these layers can be replaced in a cornea replacement
-the stroma is made up of 200 individual layers
-during a cornea transplant, not all of these layers may be replaced; only the damaged ones will
-the stroma has a perfect balance of fluid pumped into and out of it
-if this balance is upset, the surface of the stroma will be come cloudy instead of transparent and vision will be compromised
-when replacing the bottom layer of the eye, an air bubble is injected to hold the transplant in place
-when replacing the middle and top layers of the eye, nylon sutures are used to secure the tissue
-these sutures can stay in the eye anywhere from 3 months to a year to permanently
-because there is no blood flow in the eye, it takes a long time for the tissue to heal
-bone grafts can come from donated tissue or your own tissue
-bone graft unions are weaker for smokers
-people waiting for cornea transplants do not have to wait as long as those waiting for other organ transplants
-following a bone graft, patients may be prescribed pain medication
-applying heat to a healing bone graft may make it heal faster
-cornea transplants are relatively short, outpatient procedures
-blood donation can occur one of 2 ways; either all blood components are taken from the donator or the blood components are put through a machine to separate it into its basic components
-blood is made up of red blood cells, platelets, etc.
-when bone grafts come from another person, medical facilities screen the donors medical history in order to make sure the bone graft is not diseased
-cornea transplants come from deceased donors
-most humans can donate 1 pint of blood at a time safely
-fluids lost from blood donation are replaced within 24 hours of donation
-red blood cells lost from blood donation are replaced within 1-3 weeks
-healthcare workers must sanitize the skin area that blood is drawn from
-a large needle is used to draw blood for donation
-large needles are used so as not to cause shearing to the flow of the red blood cells
-blood donations are collected in flexible plastic bags
-bone graft donations are frozen after they are screened
-the top layer in the eye absorbs oxygen from tears in order to get nutrients
-the epithelium in the eye is self healing
-the endothelium in the eye can stretch when damage occurs
-bones are made up of osteoblasts and osteoclasts
-osteoclasts are responsible for creating new bone cells
-osteoblasts are responsible for tearing down old bone cells
-bone cells are created in bone marrow
-when bone grafts are taken from your own body instead of a donor, surgeons usually use bone from your pelvis
-scientists have been searching for a synthetic material to use in bone grafts instead of real bone; however real bone still works the best
-bone grafts may have trouble healing in patients that are exposed to radiation or chemotherapy
-
",layers cornea layer epithelium layer endothelium layer stroma combination layers cornea replacement stroma layers cornea transplant layers stroma balance fluid balance surface stroma vision layer eye air bubble transplant layers eye nylon sutures tissue sutures eye blood flow eye tissue bone tissue tissue bone graft smokers cornea transplants organ transplants bone graft patients pain medication heat healing bone graft cornea transplants outpatient procedures blood donation blood components blood components machine components blood blood cells platelets bone screen donors history bone graft cornea transplants donors pint blood fluids blood donation donation blood cells blood donation healthcare skin blood needle blood donation needles cause shearing flow blood cells blood donations plastic bone graft donations layer eye oxygen tears nutrients epithelium eye healing endothelium eye stretch damage bones osteoblasts bone cells osteoblasts bone cells bone cells bone marrow bone body donor surgeons bone scientists material bone bone bone bone healing patients radiation chemotherapy,150,7.50
207,425,1013,1,k2,"Blood Donations:
-There are multiple different types of ways you can donate blood. The most common is whole blood donations. 
-When you donate whole blood you usually donate about a pint. The blood taken will be replenished within 24 hours.
-Whole blood donations take about an hour total, with the donation part only taking 10 minutes.
-You can also do a double cell donation, where you re donating blood cells. There are more rules to be able to donate this, but 1 double cell donation can help between 1 and 4 transfusions, where as it takes 3-4 whole blood donations to count for 1 transfusion.
-Double cell donations take about a half hour longer than whole blood donations
-You can also donate platelets and plasma.
-Donating plasma doesnt hurt you at all, many people have this done. The needle will take out the plasma and put all the cells back into you after the donation.
-Plasma donations will take longer than both whole blood and double cell donations.

Bone Graft:
-These are mainly done with bones of deceased people. There is a tissue bank that preps all the bones to make sure they arent contaminated, and then they are sent for bone grafts.
-You can place a piece of the bone wherever you need the new cells, and cells will start to form. Or you can do this with the bone marrow instead.
-Healing time for bone grafts depends on the size of the graft. 

Corneal Transplants:
-You have to wait the least amount of time for these, since many people are offering to donate their corneas.
-There are 3 layers to the cornea, and most surgeries you only donate one or two layers, but some surgeries you can donate all of them.
-The cornea is the dome shaped part of the eye, and deals with all the focusing of your vision, so if you start to lose this focusing , you begin to have a lot of difficulties seeing.
",blood donations blood blood donations blood pint blood blood donations donation cell donation blood cells cell donation transfusions blood donations transfusion cell donations blood donations platelets plasma plasma needle plasma cells donation plasma donations blood cell donations bone graft bones tissue bank bones bone bone cells cells bone marrow healing bone graft transplants corneas layers cornea surgeries layers surgeries cornea eye vision,62,3.10
208,426,2010,1,k2,"Blood transfusions are extremely common all over the world and are used to supplement the needs of sick or injured people.  A  standard  blood draw is taken from a prominent vein usually from the inside of the elbow and is done with a large needle to keep the red blood cells from being damaged  as they would be with a small needle. If only red blood cells are extracted they usually go into a small tube for tests.  If other parts of the blood are needed such as separate red blood cells, plasma, or platelets a machine called an apheresis is used to separate the three components and the blood that is left is stored in a sterile plastic bag and put back into the donor.  Giving blood is  very common and the fluid is usually replaced within 24 hours.  Red blood cells are replaced in 1-2 weeks.


Bone grafts have become very common for the repair of diseased, broken or damaged  bones, ligaments and tendons.  A storage facility under extremely low temperature stores bones taken (usually for corpses) for use when needed for use on a live person..  a depression as one example is put into a damaged bone  cleaned and sterilized and the donor graft shaped and fit into the place it is needed.    A graft from a storage unit is called an allgraft and one from the same person is called a self graft.  Infection is watched for carefully and the bones will slowly grow together giving the individual use of the damaged part.
",blood transfusions supplement blood vein needle blood cells needle blood cells tests blood blood cells plasma platelets machine apheresis components blood plastic donor blood fluid blood cells bone repair bones ligaments tendons storage bones bone donor graft graft storage graft infection bones,42,2.10
209,427,1014,1,k2,"Allographs can be somewhat dangerous because you body might not accept the transplant.
Autographs are usually taken from the hip, not the spine or knee.
O blood is the universal donor.
AB blood is the universal receiver.
Blood donations are put in flexible bags. 
Aphersis takes 1-4 hours.
Apheres can be used for cancer patients, like those with leukemia, because it filters out bad blood and can put the good blood back in.
During apheres, two IVs are hooked to the veins, and sometimes it goes in the neck because the person may have weak veins. 
People must weigh 110 pounds to give blood.
Theres no weight limit for giving blood, except some have restrictions on how heavy you can be to sit in the donation chair.
You are more likely to get struck by lighting or stung by a bee/wasp than get HIV from a bone graft.
You have a 1 in 1.57 million (something like that) chance of contracting HIV from a bone graft. 
After you give blood, your fluids will return to normal in 48 hours and your red blood cells with return in several weeks.
You cannot give blood if you are pregnant, just had a baby, or are nursing. 
Some babies have jaundice, which is having too much bublin in your blood and your liver cannot quite process it correctly.
Jaundice is characterized by yellow skin and yellow eyes. 
Jaundice is easily treatable because it is diagnosed early.
The placenta helps process the blubin before a baby is born.
O blood is only given to patients who need it immediately and they do not have time to test for blood type. 
",body transplant hip spine knee blood donor blood blood donations cancer patients leukemia filters blood blood veins neck veins pounds blood weight limit blood donation bone graft bone graft blood fluids return blood cells return blood baby jaundice blood liver process jaundice skin eyes jaundice placenta process baby blood patients test blood,52,2.60
